{
  "version": "0.1",
  "asset_id": "coffee-flow-infographic",
  "goal": "Explain the automatic coffee machine flow in a scan-friendly learning graphic.",
  "audience": "New café technicians",
  "deliverable": {
    "type": "infographic",
    "width": 1536,
    "height": 1024,
    "format": "png",
    "transparent_background": false
  },
  "content": {
    "subject": "Five-stage automatic coffee machine flow",
    "exact_text": ["BEANS", "GRIND", "BREW", "EXTRACT", "CUP"],
    "must_include": ["Five modules", "Left-to-right arrows", "One label per module"],
    "must_avoid": ["Long paragraphs", "Unlabeled arrows", "Watermarks"]
  },
  "art_direction": {
    "style": "Clean technical infographic",
    "palette": ["warm white", "coffee brown", "muted teal"],
    "lighting": "Flat diagram lighting",
    "materials": ["vector-like shapes", "subtle paper texture"]
  },
  "composition": {
    "layout": "Five equal modules in one left-to-right flow",
    "viewpoint": "Straight-on diagram",
    "focal_hierarchy": ["Five-stage flow", "Module labels", "Directional arrows"]
  },
  "references": [],
  "qa": {
    "objective_checks": ["Output is 1536x1024 PNG", "Exactly five modules are present"],
    "visual_checks": ["Flow direction is unambiguous", "Labels remain readable"],
    "approval_required": true
  }
}

